{
  "schema_version": 2,
  "profile_id": "ru-invention",
  "jurisdiction": "ru",
  "application_kind": "invention",
  "default_language": "ru",
  "allowed_languages": ["ru"],
  "drafting_modes": ["new_draft", "revise", "translate_adapt"],
  "filing_contexts": ["pre_filing", "filed_pending"],
  "profile_reference": "references/profiles/ru-invention.md",
  "common_references": [
    "references/common/drafting-workflow.md",
    "references/common/evidence-and-no-fabrication.md",
    "references/common/claim-first-method.md",
    "references/common/deliverable-contract.md"
  ],
  "jurisdiction_references": [
    "references/ru/source-manifest.md",
    "references/ru/authority-and-verification.md",
    "references/ru/core-drafting.md",
    "references/ru/invention-drafting.md",
    "references/ru/terminology.md",
    "references/ru/translation-review.md"
  ],
  "templates": [
    "assets/intake-common.yaml",
    "assets/evidence-inventory.yaml",
    "assets/templates/invention-thesis.md",
    "assets/templates/claim-plan.md",
    "assets/templates/support-map.md",
    "assets/templates/terminology-map.md",
    "assets/templates/drawings-brief.md",
    "assets/templates/unresolved-decisions.md",
    "assets/templates/ru-invention-description.md",
    "assets/templates/ru-invention-claims.md",
    "assets/templates/ru-abstract.md",
    "assets/templates/ru-rule-check.md"
  ],
  "mode_templates": {
    "translate_adapt": [
      "assets/templates/ru-translation-review.md"
    ]
  },
  "foundation_status": "drafting_ready"
}
